recorded_at_utc	git_commit	git_branch	cv_log_loss	delta	best_epoch	status	description	cv_rps	val_log_loss	test_log_loss	cv_metrics_json	test_metrics_json
2026-03-08T14:34:18.297598+00:00	e6d9faf	codex/eval-harness-lockdown	0.971252		1	keep	eval-harness-lockdown	0.196006	0.965712	0.973130	"{""accuracy"":0.542865315318139,""avg_profit"":0.06022268598912847,""brier"":0.577549632607307,""log_loss"":0.9712522800425143,""n_bets"":208.0,""rps"":0.19600581204191855,""total_profit"":14.39}"	"{""accuracy"":0.5385375494071146,""avg_profit"":0.03289017341040463,""brier"":0.5788444715415397,""log_loss"":0.9731296175910481,""n_bets"":173,""rps"":0.1955838986732598,""total_profit"":5.690000000000001}"
2026-03-08T15:15:22.890182+00:00	51ed55f	experiment/shared-gate	0.971235	0.000017	1	discard	shared-gate	0.196014	0.966022	0.972998	"{""accuracy"":0.5424428396104921,""avg_profit"":0.06239493177387914,""brier"":0.5775622347524977,""log_loss"":0.9712349424901356,""n_bets"":263.0,""rps"":0.19601383416814497,""total_profit"":17.196666666666665}"	"{""accuracy"":0.5385375494071146,""avg_profit"":0.21363636363636362,""brier"":0.5787484220041605,""log_loss"":0.9729980619753632,""n_bets"":110,""rps"":0.19553208292465202,""total_profit"":23.5}"
2026-03-08T15:17:08.606910+00:00	96e3db4	experiment/shared-gate-no-sum-r5	0.971112	0.000123	1	discard	shared-gate-no-sum-r5	0.195979	0.965050	0.973007	"{""accuracy"":0.5422218216689275,""avg_profit"":-0.007935151268484616,""brier"":0.5774482435519919,""log_loss"":0.9711119614879654,""n_bets"":130.33333333333334,""rps"":0.19597948470076995,""total_profit"":20.53}"	"{""accuracy"":0.5405138339920948,""avg_profit"":0.12492822966507176,""brier"":0.5788067864059597,""log_loss"":0.9730072557263141,""n_bets"":209,""rps"":0.195498953127157,""total_profit"":26.11}"
2026-03-08T15:18:41.239851+00:00	29a5a9a	experiment/shared-gate-no-sum-r5-no-adj-r10	0.971011	0.000101	2	discard	shared-gate-no-sum-r5-no-adj-r10	0.195931	0.965384	0.972832	"{""accuracy"":0.5407265378032531,""avg_profit"":-0.02083606272875641,""brier"":0.5773400127632944,""log_loss"":0.9710113399568439,""n_bets"":644.0,""rps"":0.1959305063135297,""total_profit"":-13.410000000000002}"	"{""accuracy"":0.5434782608695652,""avg_profit"":0.08239819004524887,""brier"":0.5784295642283908,""log_loss"":0.972831648378849,""n_bets"":442,""rps"":0.19530921918018676,""total_profit"":36.42}"
2026-03-08T15:21:54.167698+00:00	147b83a	experiment/shared-gate-lean-no-cat	0.970824	0.000188	2	discard	shared-gate-lean-no-cat	0.195916	0.965603	0.973081	"{""accuracy"":0.5417824596826817,""avg_profit"":0.037034628012596466,""brier"":0.5771365685890283,""log_loss"":0.9708237274253876,""n_bets"":682.3333333333334,""rps"":0.1959164141243651,""total_profit"":10.78666666666667}"	"{""accuracy"":0.5405138339920948,""avg_profit"":0.013882863340563989,""brier"":0.5786878570323606,""log_loss"":0.9730810909102595,""n_bets"":461,""rps"":0.1954032929514271,""total_profit"":6.399999999999999}"
2026-03-08T15:23:32.576912+00:00	865195f	experiment/shared-gate-lean-no-cat-linear-gate	0.970809	0.000015	2	discard	shared-gate-lean-no-cat-linear-gate	0.195893	0.965124	0.973435	"{""accuracy"":0.5415217866107748,""avg_profit"":0.012531556399988208,""brier"":0.5771577541041871,""log_loss"":0.9708088804925924,""n_bets"":668.3333333333334,""rps"":0.19589312309705456,""total_profit"":-6.856666666666665}"	"{""accuracy"":0.5365612648221344,""avg_profit"":0.003867187499999994,""brier"":0.5789425046057401,""log_loss"":0.9734350363318897,""n_bets"":512,""rps"":0.1956027765731289,""total_profit"":1.9799999999999969}"
2026-03-08T15:40:17.218557+00:00	cb506c9	experiment/gate-budget-032	0.970794	0.000014	2	discard	gate-budget-032	0.195880	0.965234	0.973485	"{""accuracy"":0.5419632877145276,""avg_profit"":0.011455068309600885,""brier"":0.577142927523549,""log_loss"":0.9707944633693509,""n_bets"":698.3333333333334,""rps"":0.19587973710491588,""total_profit"":-6.636666666666666}"	"{""accuracy"":0.5385375494071146,""avg_profit"":0.014339622641509423,""brier"":0.5789709210743254,""log_loss"":0.9734852206466816,""n_bets"":530,""rps"":0.19561411020349276,""total_profit"":7.599999999999994}"
2026-03-08T15:41:26.294915+00:00	ab1fffa	experiment/gate-mean-high	0.970790	0.000005	2	discard	gate-mean-high	0.195878	0.965266	0.973490	"{""accuracy"":0.5419632877145276,""avg_profit"":0.014817751282501587,""brier"":0.5771361230084766,""log_loss"":0.9707898426910724,""n_bets"":705.0,""rps"":0.1958780341919454,""total_profit"":-4.423333333333332}"	"{""accuracy"":0.5385375494071146,""avg_profit"":0.007969639468690701,""brier"":0.5789718269836248,""log_loss"":0.9734900853109059,""n_bets"":527,""rps"":0.19561439651248813,""total_profit"":4.199999999999999}"
2026-03-08T15:47:12.054472+00:00	3e01c5b	experiment/wd-1e4	0.970790	0.000000	2	discard	wd-1e4	0.195878	0.965266	0.973490	"{""accuracy"":0.5419632877145276,""avg_profit"":0.014817751282501587,""brier"":0.5771360986605808,""log_loss"":0.9707898152194533,""n_bets"":705.0,""rps"":0.19587802563982204,""total_profit"":-4.423333333333332}"	"{""accuracy"":0.5385375494071146,""avg_profit"":0.007969639468690701,""brier"":0.5789718188865574,""log_loss"":0.9734900938655999,""n_bets"":527,""rps"":0.19561439534945005,""total_profit"":4.199999999999999}"
2026-03-08T15:56:42.152910+00:00	1a46ab5	experiment/no-season-progress	0.970301	0.000489	2	discard	no-season-progress	0.195820	0.965547	0.973725	"{""accuracy"":0.5413213984034462,""avg_profit"":0.0518022421026594,""brier"":0.5768570774335731,""log_loss"":0.9703011031171437,""n_bets"":776.0,""rps"":0.19582012878160768,""total_profit"":24.8}"	"{""accuracy"":0.5424901185770751,""avg_profit"":0.030018867924528275,""brier"":0.5790856489947104,""log_loss"":0.9737252599397999,""n_bets"":530,""rps"":0.19559601665920498,""total_profit"":15.909999999999986}"
2026-03-08T16:00:48.064563+00:00	c529974	experiment/no-ppda	0.970196	0.000105	2	discard	no-ppda	0.195854	0.965596	0.974382	"{""accuracy"":0.5435283691428333,""avg_profit"":0.036484664180455345,""brier"":0.5767973436944116,""log_loss"":0.9701956158864751,""n_bets"":756.6666666666666,""rps"":0.19585355975666144,""total_profit"":25.97333333333334}"	"{""accuracy"":0.5345849802371542,""avg_profit"":-0.03911025145067698,""brier"":0.5794731353189334,""log_loss"":0.9743823653406791,""n_bets"":517,""rps"":0.19576439228928616,""total_profit"":-20.22}"
2026-03-08T16:03:04.913077+00:00	1ab0caa	experiment/gate-budget-028	0.970157	0.000038	2	discard	gate-budget-028	0.195850	0.965607	0.974377	"{""accuracy"":0.5435283691428333,""avg_profit"":0.03132798092614939,""brier"":0.5767778336333469,""log_loss"":0.9701574799108243,""n_bets"":735.0,""rps"":0.19585010188392937,""total_profit"":21.86}"	"{""accuracy"":0.5395256916996047,""avg_profit"":-0.01946153846153847,""brier"":0.5794715671622668,""log_loss"":0.9743766307891997,""n_bets"":520,""rps"":0.19576546416046173,""total_profit"":-10.120000000000005}"
2026-03-08T16:03:40.709726+00:00	cc25fb6	experiment/gate-mean-005	0.970153	0.000004	2	discard	gate-mean-005	0.195849	0.965605	0.974376	"{""accuracy"":0.5435283691428333,""avg_profit"":0.03156831149283979,""brier"":0.5767755569970047,""log_loss"":0.9701533270232875,""n_bets"":734.3333333333334,""rps"":0.1958491714999695,""total_profit"":22.026666666666667}"	"{""accuracy"":0.5395256916996047,""avg_profit"":-0.02575815738963532,""brier"":0.5794707810691813,""log_loss"":0.9743763763116098,""n_bets"":521,""rps"":0.1957646614696589,""total_profit"":-13.420000000000002}"
2026-03-08T16:04:47.795727+00:00	e0910f8	experiment/wd-5e5	0.970153	0.000000	2	discard	wd-5e5	0.195849	0.965605	0.974376	"{""accuracy"":0.5435283691428333,""avg_profit"":0.03156831149283979,""brier"":0.576775550308509,""log_loss"":0.9701533191063616,""n_bets"":734.3333333333334,""rps"":0.1958491701714696,""total_profit"":22.026666666666667}"	"{""accuracy"":0.5395256916996047,""avg_profit"":-0.02575815738963532,""brier"":0.579470796299574,""log_loss"":0.9743764067015939,""n_bets"":521,""rps"":0.195764667732459,""total_profit"":-13.420000000000002}"
2026-03-08T16:05:21.794225+00:00	1ab3518	experiment/no-gate-sat-final	0.970152	0.000001	2	discard	no-gate-sat-final	0.195849	0.965606	0.974377	"{""accuracy"":0.5435283691428333,""avg_profit"":0.032561111513351476,""brier"":0.5767751297742384,""log_loss"":0.9701524453997226,""n_bets"":733.6666666666666,""rps"":0.19584902556432718,""total_profit"":22.693333333333328}"	"{""accuracy"":0.5395256916996047,""avg_profit"":-0.02388461538461539,""brier"":0.5794709600414805,""log_loss"":0.9743766044494594,""n_bets"":520,""rps"":0.19576482318801877,""total_profit"":-12.420000000000002}"
2026-03-08T17:05:38.246913+00:00	d6f5d15	codex/exp-gate-budget-014	0.970049	0.000104	2	keep	gate-budget-014	0.195846	0.965587	0.974355	"{""accuracy"":0.5426744398088634,""avg_profit"":0.04945508279585902,""brier"":0.5767258690115293,""log_loss"":0.9700488150744803,""n_bets"":576.6666666666666,""rps"":0.1958464771489429,""total_profit"":33.279999999999994}"	"{""accuracy"":0.5395256916996047,""avg_profit"":-0.023717171717171713,""brier"":0.5794626991277873,""log_loss"":0.9743545894990825,""n_bets"":495,""rps"":0.1957761210405578,""total_profit"":-11.739999999999998}"
2026-03-08T17:32:27.899282+00:00	cf789ca	codex/exp-gate-budget-014	0.969982	0.000067	2	keep	gate-budget-014	0.195835	0.965349	0.974744	"{""accuracy"":0.5428473594807867,""avg_profit"":0.045991366324185275,""brier"":0.5766764474665007,""log_loss"":0.9699815971821621,""n_bets"":717.0,""rps"":0.1958353477354695,""total_profit"":28.63}"	"{""accuracy"":0.5375494071146245,""avg_profit"":-0.04613430127041743,""brier"":0.5796621394431039,""log_loss"":0.974743873214587,""n_bets"":551,""rps"":0.19584880870348775,""total_profit"":-25.42}"
2026-03-08T18:02:10.435360+00:00	aae9ca2	codex/exp-gate-budget-014	0.969777	0.000205	2	keep	gate-budget-014	0.195727	0.965953	0.974711	"{""accuracy"":0.543709197174679,""avg_profit"":0.054525104286181125,""brier"":0.5765220278589022,""log_loss"":0.9697765835152383,""n_bets"":731.3333333333334,""rps"":0.19572744982388549,""total_profit"":32.02333333333333}"	"{""accuracy"":0.5385375494071146,""avg_profit"":-0.058266423357664236,""brier"":0.5797180087143944,""log_loss"":0.9747107594795595,""n_bets"":548,""rps"":0.19578887782144086,""total_profit"":-31.93}"
2026-03-08T18:10:24.527960+00:00	aae9ca2	codex/exp-gate-budget-014	0.970274	-0.000498	1	discard	gate-budget-014	0.195800	0.965872	0.974038	"{""accuracy"":0.5424428396104921,""avg_profit"":0.05977233169690641,""brier"":0.5769093451747737,""log_loss"":0.9702744270495837,""n_bets"":214.33333333333334,""rps"":0.19580000868043737,""total_profit"":37.36}"	"{""accuracy"":0.541501976284585,""avg_profit"":-0.000110294117647063,""brier"":0.5793953109420251,""log_loss"":0.9740378147658713,""n_bets"":272,""rps"":0.19568216046172893,""total_profit"":-0.030000000000001137}"
2026-03-08T18:11:32.548933+00:00	aae9ca2	codex/exp-gate-budget-014	0.969645	0.000630	2	keep	gate-budget-014	0.195701	0.965771	0.974059	"{""accuracy"":0.5437189772624205,""avg_profit"":0.04849088387779688,""brier"":0.5764442247800164,""log_loss"":0.9696448175636956,""n_bets"":725.0,""rps"":0.19570088742356426,""total_profit"":27.776666666666667}"	"{""accuracy"":0.5395256916996047,""avg_profit"":-0.07889492753623188,""brier"":0.579295951489376,""log_loss"":0.974058666736767,""n_bets"":552,""rps"":0.1955553571112414,""total_profit"":-43.55}"
2026-03-08T23:10:27.217171+00:00	fd90a37	codex/experiment/league-residual-bias	0.969630	0.000015	2	keep	league-residual-bias	0.195698	0.965740	0.973447	"{""accuracy"":0.5441414529700673,""avg_profit"":0.04921900225486664,""brier"":0.5764356334468604,""log_loss"":0.969630037101736,""n_bets"":726.3333333333334,""rps"":0.1956978993591215,""total_profit"":28.103333333333335}"	"{""accuracy"":0.5365612648221344,""avg_profit"":-0.026377952755905522,""brier"":0.5788849481937076,""log_loss"":0.9734468038483806,""n_bets"":508,""rps"":0.1954119884152177,""total_profit"":-13.400000000000006}"
2026-03-08T23:31:02.586539+00:00	0ff67e3	codex/experiment/league-residual-bias	0.969621	0.000009	2	keep	league-residual-bias	0.195706	0.965912	0.973519	"{""accuracy"":0.5443431781258377,""avg_profit"":0.03415252638396756,""brier"":0.5764223236418012,""log_loss"":0.9696205939021088,""n_bets"":772.6666666666666,""rps"":0.19570620827749083,""total_profit"":20.466666666666672}"	"{""accuracy"":0.5355731225296443,""avg_profit"":-0.020864661654135315,""brier"":0.578924435511452,""log_loss"":0.9735190442425395,""n_bets"":532,""rps"":0.19542262581935418,""total_profit"":-11.099999999999987}"
2026-03-09T19:33:47.929365+00:00	729eb25	codex/experiment/resnet-backbone	0.969540	0.000080	2	keep	resnet-backbone	0.195555	0.965042	0.976339	"{""accuracy"":0.5394789382454838,""avg_profit"":0.014233666840453353,""brier"":0.5763446687855,""log_loss"":0.969540266989839,""n_bets"":520.0,""rps"":0.19555543392474414,""total_profit"":22.12}"	"{""accuracy"":0.5355731225296443,""avg_profit"":0.03310924369747899,""brier"":0.5802879829182468,""log_loss"":0.9763393578799534,""n_bets"":595,""rps"":0.1959419018043824,""total_profit"":19.7}"
2026-03-09T19:40:02.692739+00:00	729eb25	codex/experiment/resnet-backbone	0.969278	0.000262	2	keep	resnet-backbone	0.195532	0.964327	0.976197	"{""accuracy"":0.5412148002282056,""avg_profit"":0.048324457868815514,""brier"":0.5762114204855435,""log_loss"":0.9692784556467932,""n_bets"":450.6666666666667,""rps"":0.195531676548467,""total_profit"":35.48}"	"{""accuracy"":0.5385375494071146,""avg_profit"":0.028701067615658354,""brier"":0.5802335717763832,""log_loss"":0.9761972349240484,""n_bets"":562,""rps"":0.19593070453160297,""total_profit"":16.129999999999995}"
2026-03-09T19:46:53.726174+00:00	729eb25	codex/experiment/resnet-backbone	0.969615	-0.000336	2	discard	resnet-backbone	0.195635	0.963358	0.975852	"{""accuracy"":0.542240579675345,""avg_profit"":0.058326181353767555,""brier"":0.5765185583906103,""log_loss"":0.9696146544897924,""n_bets"":260.0,""rps"":0.1956346500959216,""total_profit"":22.73333333333333}"	"{""accuracy"":0.5345849802371542,""avg_profit"":0.019101796407185644,""brier"":0.5800729115400733,""log_loss"":0.975851632482079,""n_bets"":501,""rps"":0.1958807962365845,""total_profit"":9.570000000000007}"
2026-03-09T19:48:27.216314+00:00	729eb25	codex/experiment/resnet-backbone	0.969384	0.000231	2	keep	resnet-backbone	0.195568	0.963758	0.975984	"{""accuracy"":0.5405139630009878,""avg_profit"":0.004839617556516726,""brier"":0.576313463071715,""log_loss"":0.9693837941955393,""n_bets"":365.6666666666667,""rps"":0.19556788076245812,""total_profit"":20.213333333333328}"	"{""accuracy"":0.5345849802371542,""avg_profit"":0.014321223709369018,""brier"":0.5801383033210127,""log_loss"":0.9759837220737784,""n_bets"":523,""rps"":0.1959035017262847,""total_profit"":7.489999999999997}"
2026-03-09T19:54:40.674840+00:00	729eb25	codex/experiment/resnet-backbone	0.969456	-0.000073	2	discard	resnet-backbone	0.195591	0.963418	0.975897	"{""accuracy"":0.5420298766008984,""avg_profit"":0.04274048983733086,""brier"":0.5763849130974759,""log_loss"":0.9694563850055998,""n_bets"":316.0,""rps"":0.19559057482117814,""total_profit"":26.53}"	"{""accuracy"":0.5345849802371542,""avg_profit"":0.02443359375000001,""brier"":0.5800967789961984,""log_loss"":0.9758967923615144,""n_bets"":512,""rps"":0.19588997807107505,""total_profit"":12.510000000000005}"
2026-03-09T19:55:55.599432+00:00	729eb25	codex/experiment/resnet-backbone	0.969832	-0.000376	2	discard	resnet-backbone	0.195639	0.963472	0.976032	"{""accuracy"":0.5407051058999518,""avg_profit"":0.029275487501351893,""brier"":0.5766171730360451,""log_loss"":0.9698324436339036,""n_bets"":321.6666666666667,""rps"":0.1956391074433991,""total_profit"":15.240000000000004}"	"{""accuracy"":0.5365612648221344,""avg_profit"":0.013171641791044787,""brier"":0.5801817050248395,""log_loss"":0.9760319762886864,""n_bets"":536,""rps"":0.19593165991189349,""total_profit"":7.060000000000006}"
2026-03-09T19:57:24.840121+00:00	729eb25	codex/experiment/resnet-backbone	0.969384	0.000449	2	keep	resnet-backbone	0.195568	0.963758	0.975984	"{""accuracy"":0.5405139630009878,""avg_profit"":0.004839617556516726,""brier"":0.576313463071715,""log_loss"":0.9693837941955393,""n_bets"":365.6666666666667,""rps"":0.19556788076245812,""total_profit"":20.213333333333328}"	"{""accuracy"":0.5345849802371542,""avg_profit"":0.014321223709369018,""brier"":0.5801383033210127,""log_loss"":0.9759837220737784,""n_bets"":523,""rps"":0.1959035017262847,""total_profit"":7.489999999999997}"
2026-03-09T19:59:43.913772+00:00	7df7baa	codex/experiment/resnet-backbone	0.969278	0.000105	2	keep	resnet-backbone	0.195532	0.964327	0.976197	"{""accuracy"":0.5412148002282056,""avg_profit"":0.048324457868815514,""brier"":0.5762114204855435,""log_loss"":0.9692784556467932,""n_bets"":450.6666666666667,""rps"":0.195531676548467,""total_profit"":35.48}"	"{""accuracy"":0.5385375494071146,""avg_profit"":0.028701067615658354,""brier"":0.5802335717763832,""log_loss"":0.9761972349240484,""n_bets"":562,""rps"":0.19593070453160297,""total_profit"":16.129999999999995}"
2026-03-09T23:16:37.043993+00:00	70c997e	codex/experiment/cross-resnet-backbone	0.968616	0.000662	1	keep	cross-resnet-backbone	0.195492	0.966433	0.973316	"{""accuracy"":0.542039924078328,""avg_profit"":0.14195468387673568,""brier"":0.5758207688446162,""log_loss"":0.968616205289191,""n_bets"":349.3333333333333,""rps"":0.1954917897615365,""total_profit"":47.800000000000004}"	"{""accuracy"":0.5365612648221344,""avg_profit"":-0.007249999999999984,""brier"":0.5789651448335126,""log_loss"":0.973316231033116,""n_bets"":40,""rps"":0.19552171370179844,""total_profit"":-0.28999999999999937}"
2026-03-09T23:22:38.102865+00:00	70c997e	codex/experiment/cross-resnet-backbone	0.968446	0.000170	1	keep	cross-resnet-backbone	0.195428	0.967011	0.973477	"{""accuracy"":0.5418284188348164,""avg_profit"":0.1475246069150433,""brier"":0.5756843806505878,""log_loss"":0.9684458926578214,""n_bets"":392.0,""rps"":0.19542824701516212,""total_profit"":54.879999999999995}"	"{""accuracy"":0.5365612648221344,""avg_profit"":-0.16474576271186442,""brier"":0.5790745652712599,""log_loss"":0.9734772590666769,""n_bets"":59,""rps"":0.19557164542856756,""total_profit"":-9.72}"
2026-03-09T23:32:17.620154+00:00	70c997e	codex/experiment/cross-resnet-backbone	0.968268	0.000178	1	keep	cross-resnet-backbone	0.195370	0.967740	0.973268	"{""accuracy"":0.5415981555848869,""avg_profit"":0.10397631040284877,""brier"":0.575517496361242,""log_loss"":0.9682681254030422,""n_bets"":492.0,""rps"":0.19536997129975173,""total_profit"":48.60999999999999}"	"{""accuracy"":0.5385375494071146,""avg_profit"":-0.12652631578947365,""brier"":0.5789434301069707,""log_loss"":0.9732679486235745,""n_bets"":95,""rps"":0.1955092694944125,""total_profit"":-12.019999999999996}"
2026-03-09T23:37:34.468720+00:00	70c997e	codex/experiment/cross-resnet-backbone	0.968220	0.000048	1	keep	cross-resnet-backbone	0.195351	0.968249	0.973185	"{""accuracy"":0.5418387337019345,""avg_profit"":0.09528101415044632,""brier"":0.5754617511690668,""log_loss"":0.9682196380583236,""n_bets"":542.3333333333334,""rps"":0.1953513649105292,""total_profit"":50.60333333333333}"	"{""accuracy"":0.5395256916996047,""avg_profit"":-0.05298387096774194,""brier"":0.5788834021091167,""log_loss"":0.9731851972146569,""n_bets"":124,""rps"":0.1954894281127266,""total_profit"":-6.57}"
2026-03-10T18:53:33.969195+00:00	7dad4b9	experiment/repulsion-1.5	0.967943	0.000277	1	keep	repulsion-lambda-1.5	0.195325	0.968394	0.973393	"{""accuracy"":0.5394009649332413,""avg_profit"":0.08010011916051958,""brier"":0.5752728730875066,""log_loss"":0.9679434908314047,""n_bets"":615.0,""rps"":0.19532467454452052,""total_profit"":47.169999999999995}"	"{""accuracy"":0.5385375494071146,""avg_profit"":-0.049370078740157475,""brier"":0.5790289358700892,""log_loss"":0.9733930358879913,""n_bets"":127,""rps"":0.19554050979583032,""total_profit"":-6.27}"
