recorded_at_utc	git_commit	git_branch	cv_log_loss	delta	best_epoch	status	description	cv_rps	val_log_loss	test_log_loss	cv_metrics_json	test_metrics_json
2026-04-04T10:20:48.455752+00:00	ce3fb95	experiment/set-transformer-frontier	0.973372	-0.004244	13	discard	pos8 cross2	0.196212	0.966829	0.973709	"{""accuracy"":0.5378021109477378,""bankroll_bet_count"":1278.6666666666667,""bankroll_roi"":3.2384733250390134,""brier"":0.5792064003514136,""corr_with_implied"":0.9121717335855273,""log_loss"":0.9733723799387614,""max_drawdown"":0.7534830763248704,""rps"":0.1962119443793048}"	"{""accuracy"":0.5355731225296443,""bankroll_bet_count"":430,""bankroll_roi"":-0.12912601570637391,""brier"":0.5792347421818493,""corr_with_implied"":0.9678670784782519,""log_loss"":0.9737085700035095,""max_drawdown"":0.2815516567232128,""rps"":0.19551558271616762}"
2026-04-04T10:28:15.148192+00:00	ce3fb95	experiment/set-transformer-frontier	0.972021	-0.002893	13	discard	pma2 cross2	0.196011	0.966308	0.973828	"{""accuracy"":0.5360058773315982,""bankroll_bet_count"":856.3333333333334,""bankroll_roi"":2.1619973988605747,""brier"":0.5779870827661882,""corr_with_implied"":0.9539298570884229,""log_loss"":0.9720210234324137,""max_drawdown"":0.40764267414014804,""rps"":0.196010892563054}"	"{""accuracy"":0.5375494071146245,""bankroll_bet_count"":427,""bankroll_roi"":-0.12550082747991056,""brier"":0.5792927661814319,""corr_with_implied"":0.9670952911165216,""log_loss"":0.973828136920929,""max_drawdown"":0.27060811729863155,""rps"":0.19553477797073301}"
2026-04-04T10:55:06.572108+00:00	ce3fb95	experiment/set-transformer-frontier	0.969036	0.000092	9	discard	baseline raw epoch	0.194982	0.966537	0.977044	"{""accuracy"":0.5406615532550126,""bankroll_bet_count"":1250.3333333333333,""bankroll_roi"":8.899242359188296,""brier"":0.576148756624817,""corr_with_implied"":0.9334234052373387,""log_loss"":0.9690364400545756,""max_drawdown"":0.6508500436103218,""rps"":0.19498212465687592}"	"{""accuracy"":0.5276679841897233,""bankroll_bet_count"":800,""bankroll_roi"":0.5160765232907215,""brier"":0.5809433806690346,""corr_with_implied"":0.9364025810567137,""log_loss"":0.9770435094833374,""max_drawdown"":0.4251507426871474,""rps"":0.19645577874920314}"
2026-04-04T11:07:19.717023+00:00	ce3fb95	experiment/set-transformer-frontier	0.970662	-0.001534	23	discard	cross team2 raw epoch	0.195429	0.966260	0.986103	"{""accuracy"":0.5423012186984512,""bankroll_bet_count"":1272.6666666666667,""bankroll_roi"":6.290632339305752,""brier"":0.577291875893127,""corr_with_implied"":0.9280764948217838,""log_loss"":0.9706615606943766,""max_drawdown"":0.7403149349118564,""rps"":0.19542888325628996}"	"{""accuracy"":0.5217391304347826,""bankroll_bet_count"":848,""bankroll_roi"":-0.5989898004489151,""brier"":0.586818538093477,""corr_with_implied"":0.9048742630095049,""log_loss"":0.9861027598381042,""max_drawdown"":0.7564283682891585,""rps"":0.1995421284782502}"
2026-04-04T11:43:28.930312+00:00	ce3fb95	experiment/set-transformer-frontier	0.970176	-0.001048	13	discard	baseline raw epoch rerun	0.195303	0.966264	0.977944	"{""accuracy"":0.5413615883131652,""bankroll_bet_count"":1270.6666666666667,""bankroll_roi"":9.027370452833063,""brier"":0.5770741968987456,""corr_with_implied"":0.9200200870544718,""log_loss"":0.9701762000719706,""max_drawdown"":0.6912374948375479,""rps"":0.19530264505807393}"	"{""accuracy"":0.525691699604743,""bankroll_bet_count"":832,""bankroll_roi"":-0.03787646511199952,""brier"":0.581601725649463,""corr_with_implied"":0.9350765565075482,""log_loss"":0.9779443740844727,""max_drawdown"":0.4883958375245378,""rps"":0.19672654081914454}"
2026-04-04T11:52:36.966834+00:00	ce3fb95	experiment/set-transformer-frontier	0.971949	-0.002821	19	discard	baseline raw epoch deterministic a	0.195809	0.965597	0.977648	"{""accuracy"":0.5390771790409125,""bankroll_bet_count"":1282.3333333333333,""bankroll_roi"":12.197562222519982,""brier"":0.5781963029564349,""corr_with_implied"":0.8977361850265279,""log_loss"":0.9719487627347311,""max_drawdown"":0.7305272763927259,""rps"":0.19580865639910025}"	"{""accuracy"":0.5296442687747036,""bankroll_bet_count"":817,""bankroll_roi"":-0.22139203152035222,""brier"":0.5812021132050864,""corr_with_implied"":0.934473539581168,""log_loss"":0.9776480793952942,""max_drawdown"":0.5220419203965913,""rps"":0.19648638892448317}"
2026-04-04T11:57:28.637055+00:00	ce3fb95	experiment/set-transformer-frontier	0.969718	-0.000590	11	discard	baseline raw epoch deterministic b	0.195187	0.967308	0.976467	"{""accuracy"":0.5415057025012411,""bankroll_bet_count"":1274.3333333333333,""bankroll_roi"":9.19462618107694,""brier"":0.5767588754701339,""corr_with_implied"":0.9294626244903247,""log_loss"":0.9697179794311523,""max_drawdown"":0.6291895161991228,""rps"":0.1951870259686689}"	"{""accuracy"":0.532608695652174,""bankroll_bet_count"":804,""bankroll_roi"":0.5368460667119962,""brier"":0.5805364489589443,""corr_with_implied"":0.9385913127665709,""log_loss"":0.9764667749404907,""max_drawdown"":0.44303096492947247,""rps"":0.19632513196972895}"
2026-04-04T12:04:27.329966+00:00	ce3fb95	experiment/set-transformer-frontier	0.969475	-0.000347	7	discard	baseline raw epoch ordered a	0.195199	0.966265	0.977952	"{""accuracy"":0.5389814305121667,""bankroll_bet_count"":1260.3333333333333,""bankroll_roi"":15.156122716479494,""brier"":0.5766093115384848,""corr_with_implied"":0.9253685820841158,""log_loss"":0.969474713007609,""max_drawdown"":0.7281368904915987,""rps"":0.19519856235703273}"	"{""accuracy"":0.5286561264822134,""bankroll_bet_count"":786,""bankroll_roi"":-0.16959587792488662,""brier"":0.58154024691631,""corr_with_implied"":0.9382304837856799,""log_loss"":0.9779519438743591,""max_drawdown"":0.5054985241187632,""rps"":0.19671626499505335}"
2026-04-04T12:08:51.643684+00:00	ce3fb95	experiment/set-transformer-frontier	0.969475	-0.000347	7	discard	baseline raw epoch ordered b	0.195199	0.966265	0.977952	"{""accuracy"":0.5389814305121667,""bankroll_bet_count"":1260.3333333333333,""bankroll_roi"":15.156122716479494,""brier"":0.5766093115384848,""corr_with_implied"":0.9253685820841158,""log_loss"":0.969474713007609,""max_drawdown"":0.7281368904915987,""rps"":0.19519856235703273}"	"{""accuracy"":0.5286561264822134,""bankroll_bet_count"":786,""bankroll_roi"":-0.16959587792488662,""brier"":0.58154024691631,""corr_with_implied"":0.9382304837856799,""log_loss"":0.9779519438743591,""max_drawdown"":0.5054985241187632,""rps"":0.19671626499505335}"
2026-04-04T12:18:33.632776+00:00	ce3fb95	experiment/set-transformer-frontier	0.971773	-0.002645	26	discard	baseline ordered smoothed	0.195695	0.966265	0.986220	"{""accuracy"":0.5382396012061648,""bankroll_bet_count"":1259.3333333333333,""bankroll_roi"":0.33560435669462724,""brier"":0.577746253877864,""corr_with_implied"":0.9221810477533943,""log_loss"":0.9717727899551392,""max_drawdown"":0.7182084684590366,""rps"":0.19569544285718543}"	"{""accuracy"":0.5247035573122529,""bankroll_bet_count"":840,""bankroll_roi"":-0.7561169733714912,""brier"":0.5872523355834142,""corr_with_implied"":0.9074784869275977,""log_loss"":0.9862199425697327,""max_drawdown"":0.8736493315935219,""rps"":0.1993981582691405}"
2026-04-04T12:26:46.024350+00:00	ce3fb95	experiment/set-transformer-frontier	0.968192	0.000936	11	discard	cross team2 ordered raw	0.194686	0.966083	0.973833	"{""accuracy"":0.5425888255263867,""bankroll_bet_count"":1242.0,""bankroll_roi"":10.721910026885595,""brier"":0.5756875843121668,""corr_with_implied"":0.9336888259983253,""log_loss"":0.9681920011838278,""max_drawdown"":0.6161653811149875,""rps"":0.19468558941803737}"	"{""accuracy"":0.5375494071146245,""bankroll_bet_count"":434,""bankroll_roi"":-0.10253874047988575,""brier"":0.5793252513055691,""corr_with_implied"":0.966798755165151,""log_loss"":0.9738333821296692,""max_drawdown"":0.27006697500275195,""rps"":0.19553818831477995}"
2026-04-04T12:35:24.379029+00:00	ce3fb95	experiment/set-transformer-frontier	0.968192	0.000936	11	keep	cross team2 ordered raw confirm	0.194686	0.966083	0.973833	"{""accuracy"":0.5425888255263867,""bankroll_bet_count"":1242.0,""bankroll_roi"":10.721910026885595,""brier"":0.5756875843121668,""corr_with_implied"":0.9336888259983253,""log_loss"":0.9681920011838278,""max_drawdown"":0.6161653811149875,""rps"":0.19468558941803737}"	"{""accuracy"":0.5375494071146245,""bankroll_bet_count"":434,""bankroll_roi"":-0.10253874047988575,""brier"":0.5793252513055691,""corr_with_implied"":0.966798755165151,""log_loss"":0.9738333821296692,""max_drawdown"":0.27006697500275195,""rps"":0.19553818831477995}"
